{
  "analysis_code": {
    "commit": null,
    "commit_state": "not_available",
    "repository": null,
    "repository_state": "not_available"
  },
  "contract": "crosscorpus-release/v1",
  "created_at": "2026-10-08T00:00:00Z",
  "excluded": {
    "records": 1,
    "schema": "crosscorpus-study-selection-record/v1",
    "sha256": "118c04fccbd8e716307d4d5b2a3bc0b99b8d42fa4a04afd360fbfaa4b053fddf"
  },
  "exclusion_reasons": [
    "overlapping_speech"
  ],
  "inputs": [
    {
      "analysis_layer": {
        "contract": null,
        "manifest_sha256": null,
        "state": "not_available"
      },
      "corpus_id": "corapan",
      "release_id": "corapan-0000-01",
      "release_manifest_sha256": "7b9bc9982c8fc83daee3a903ceaa6eafcb04bd7ff320eb7bf92d4812e40d5211"
    },
    {
      "analysis_layer": {
        "contract": null,
        "manifest_sha256": null,
        "state": "not_available"
      },
      "corpus_id": "coprepan",
      "release_id": "coprepan-0000.1",
      "release_manifest_sha256": "b595003c05ca40e61cc01bc5969328ba03d6485677da641552a9228ec990677d"
    }
  ],
  "population_id": "main",
  "schema": "crosscorpus-study-population/v1",
  "selected": {
    "records": 3,
    "schema": "crosscorpus-study-selection-record/v1",
    "sha256": "352af91d0498a6358e87eb113e3941f44773b014953b27c45a95fd8b5a765822"
  },
  "selection": {
    "description": "fixture: ids listed by hand, below the document, in both corpora",
    "filter_language": null,
    "filters": [],
    "kind": "enumerated",
    "tool": {
      "id": "fixture-builder",
      "version": "0"
    }
  },
  "study_id": "fixture_study_joint",
  "totals": [
    {
      "audio_ms": null,
      "audio_ms_state": "not_available",
      "corpus_id": "corapan",
      "documents": 1,
      "selected_records": 2,
      "tokens_counted": null,
      "tokens_counted_state": "not_available"
    },
    {
      "audio_ms": null,
      "audio_ms_state": "not_available",
      "corpus_id": "coprepan",
      "documents": 1,
      "selected_records": 1,
      "tokens_counted": null,
      "tokens_counted_state": "not_available"
    }
  ]
}
