{
  "analysis_code": {
    "commit": null,
    "commit_state": "not_available",
    "repository": null,
    "repository_state": "not_available"
  },
  "contract": "crosscorpus-release/v1",
  "created_at": "2026-10-08T00:00:00Z",
  "excluded": {
    "records": 1,
    "schema": "crosscorpus-study-selection-record/v1",
    "sha256": "03c70aa407f60d40a9ec3ca7b552e8b7488250947e54ba968f18d067d094570f"
  },
  "exclusion_reasons": [
    "no_defensible_date"
  ],
  "inputs": [
    {
      "analysis_layer": {
        "contract": null,
        "manifest_sha256": null,
        "state": "not_available"
      },
      "corpus_id": "corapan",
      "release_id": "corapan-0000-01",
      "release_manifest_sha256": "7b9bc9982c8fc83daee3a903ceaa6eafcb04bd7ff320eb7bf92d4812e40d5211"
    }
  ],
  "population_id": "main",
  "schema": "crosscorpus-study-population/v1",
  "selected": {
    "records": 1,
    "schema": "crosscorpus-study-selection-record/v1",
    "sha256": "6f0425a3e680a64fab8111020c5fb516e3a7140a221eacd574cf2f922c160fe2"
  },
  "selection": {
    "description": "fixture: one filter, one stated exclusion",
    "filter_language": "crosscorpus-document-filter/v1",
    "filters": [
      {
        "all": [
          {
            "field": "country_id",
            "in": [
              "uy"
            ]
          }
        ],
        "corpus_id": "corapan"
      }
    ],
    "kind": "declarative_filter",
    "tool": {
      "id": "fixture-builder",
      "version": "0"
    }
  },
  "study_id": "fixture_study_corapan",
  "totals": [
    {
      "audio_ms": 600000,
      "audio_ms_state": "known",
      "corpus_id": "corapan",
      "documents": 1,
      "selected_records": 1,
      "tokens_counted": 12,
      "tokens_counted_state": "known"
    }
  ]
}
